{
  "schema": "logion.instrumentation/v1",
  "subject": {
    "resource_id": "urn:air:example.com:skill:review-helper",
    "resource_version": "1.4.2",
    "distribution_digest": "sha256:abcdef0123456789"
  },
  "publisher": {
    "identity": "did:web:example.com"
  },
  "delivery": {
    "endpoint": "https://api.logion.sh/v1/resources/abc123/versions/def456/publisher-receipts",
    "mode": "asynchronous-batch",
    "max_batch": 20,
    "max_spool_bytes": 262144
  },
  "events": ["resource_invoked", "resource_file_read", "resource_tool_used"],
  "fields": [
    "resource_id",
    "resource_version",
    "distribution_digest",
    "event",
    "outcome",
    "duration_bucket",
    "harness",
    "integration_version"
  ],
  "excluded": [
    "prompt",
    "file_content",
    "local_path",
    "tool_arguments",
    "tool_results",
    "model_context",
    "secrets",
    "user_identity"
  ],
  "integration_version": "logion.publisher-reporter.v1"
}